NUMERO_REDS;ANO_FATO;MES_NUMERICO;MES_DESCRICAO;DIA_NUMERICO;DATA_FATO;HORARIO_FATO;DIA_DA_SEMANA_FATO;DIA_DA_SEMANA_NUMERICO;FAIXA_HORA_1;FAIXA_HORA_6;UF;MUNICIPIO;CODIGO_MUNICIPIO;BAIRRO;BAIRRO_NAO_CADASTRADO;LOGRADOURO;LOGRADOURO_NAO_CADASTRADO;NUMERO_LOGRADOURO;NUMERO_LOGRADOURO_NAO_CADASTRADO;DESCRICAO_LOCALIZACAO;CODIGO_NATUREZA_PRINCIPAL;DESCR_NATUREZA_PRINCIPAL;TENTADO_CONSUMADO_PRINCIPAL;CODIGO_NATUREZA_SECUNDARIA1;DESCR_NATUREZA_SECUNDARIA1;TENTADO_CONSUMADO_SECUNDARIA1;CODIGO_NATUREZA_SECUNDARIA2;DESCR_NATUREZA_SECUNDARIA2;TENTADO_CONSUMADO_SECUNDARIA2;CODIGO_NATUREZA_SECUNDARIA3;DESCR_NATUREZA_SECUNDARIA3;TENTADO_CONSUMADO_SECUNDARIA3;COMPLEMENTO_NATUREZA;CODIGO_COMPLEMENTO_NATUREZA;CAUSA_PRESUMIDA;CODIGO_CAUSA_PRESUMIDA;DESCRICAO_MEIO_UTILIZADO;CODIGO_MEIO_UTILIZADO;DESCRICAO_LOCAL_IMEDIATO;CODIGO_LOCAL_IMEDIATO;LATITUDE;LONGITUDE;CODIGO_UNID_AREA_MILITAR;UNID_AREA_MILITAR;CODIGO_UNID_AREA_NIVEL_4;UNID_AREA_NIVEL_4;CODIGO_UNID_AREA_NIVEL_5;UNID_AREA_NIVEL_5;CODIGO_UNID_AREA_NIVEL_6;UNID_AREA_NIVEL_6;CODIGO_UNID_REGISTRO_NIVEL_4;UNID_REGISTRO_NIVEL_4;CODIGO_UNID_REGISTRO_NIVEL_5;UNID_REGISTRO_NIVEL_5;CODIGO_UNID_REGISTRO_NIVEL_6;UNID_REGISTRO_NIVEL_6;CODIGO_UNID_REGISTRO_NIVEL_7;UNID_REGISTRO_NIVEL_7;SETOR;SUB_SETOR;QTDE_ARMAS_FOGO;QTDE_PRISAO;SINALIZADO;TIPO_AUDITORIA;IMV_B01121;IMV_B02001;IMV_B01148;IMV_B01504;IMV_B01129;IMV_C01157;IMV_TOTAL;ICVPE_B01121;ICVPE_B01121_MILITAR;ICVPE_B02001;ICVPE_B01148;ICVPE_B01504;ICVPE_TOTAL;ICVPA_C01157;ICVPA_C01158;ICVPA_C01159;ICVPA_TOTAL;TCO;SINTESE
2025-009982298-001;2025;3;MARCO;2;02/03/2025;15:00:00;DOMINGO;7;De 15:00 as 15:59;De 12:00 as 17:59;MG;GUAXUPE;312870;INVÁLIDO;;GXP0005 - ROSEIRA - ANDRE LUIZ CELANI;;0;;ZONA RURAL;B01121;HOMICIDIO;CONSUMADO;;;;;;;;;;TRANSEUNTE;111;ACIDENTE (NEGLIGENCIA / IMPRUDENCIA / IMPERICIA);132;ARMAS DE FOGO;300;FAZENDA;1002;-21,2318021;-46,6327064;1430;1 PEL/79 CIA PM/43 BPM/18 RPM;7473;18 RPM;6871;43 BPM;1429;79 CIA PM/43 BPM/18 RPM;M7473;18 RPM;M6871;43 BPM/18 RPM;M1429;79 CIA PM/43 BPM/18 RPM;M1429;79 CIA PM/43 BPM/18 RPM;43.79.1;43.79.1.1;1;1;NÃO;;1;0;0;0;0;0;1;0;0;0;0;0;0;0;0;0;0;NÃO;ADOLESCENTE ALEXSANDER EDUARDO AMORIM ONOFRE, 15 ANOS, FOI A OBITO POR FERIMENTO DE DISPARO DE ARMA DE FOGO, DISPARO ACIDENTAL OCORRIDO DURANTE CAÇA A CAPIVARAS NA ZONA RURAL.
2025-017589112-001;2025;4;ABRIL;16;16/04/2025;09:45:00;QUARTA-FEIRA;3;De 09:00 as 09:59;De 06:00 as 11:59;MG;GUAXUPE;312870;CENTRO;;HORACIO FERREIRA LOPES;;INVÁLIDO;;PERIMETRO URBANO;B01121;HOMICIDIO;CONSUMADO;;;;;;;;;;TRANSEUNTE;111;PASSIONAL;115;ARMAS DE FOGO;300;OFICINA ELETRICA / LANTERNAGEM / MECANICA;722;-21,2999183;-46,7199637;1430;1 PEL/79 CIA PM/43 BPM/18 RPM;7473;18 RPM;6871;43 BPM;1429;79 CIA PM/43 BPM/18 RPM;M7473;18 RPM;M6871;43 BPM/18 RPM;M1429;79 CIA PM/43 BPM/18 RPM;M1429;79 CIA PM/43 BPM/18 RPM;43.79.1;43.79.1.1;0;0;NÃO;;1;0;0;0;0;0;1;0;0;0;0;0;0;0;0;0;0;NÃO;MARCELO APARECIDO DA SILVA FOI BALEADO NAS COSTAS ENQUANTO SE ENCONTRAVA EM UMA OFICINA EM GUAXUPÉ/MG, O AUTOR SERIA EX-MARIDO DA ATUAL COMPANHEIRA DE MARCELO.
2025-022961573-001;2025;5;MAIO;18;18/05/2025;16:30:00;DOMINGO;7;De 16:00 as 16:59;De 12:00 as 17:59;MG;GUAXUPE;312870;RESIDENCIAL CONQUISTA;;JOAO LUIZ MARQUES;;0;;PERIMETRO URBANO;B01121;HOMICIDIO;CONSUMADO;;;;;;;;;;TRANSEUNTE;111;ENVOLVIMENTO COM DROGAS;121;ARMAS DE FOGO;300;VIA DE ACESSO PUBLICA;2101;-21,3202431;-46,7357457;1430;1 PEL/79 CIA PM/43 BPM/18 RPM;7473;18 RPM;6871;43 BPM;1429;79 CIA PM/43 BPM/18 RPM;M7473;18 RPM;M6871;43 BPM/18 RPM;M1429;79 CIA PM/43 BPM/18 RPM;M1429;79 CIA PM/43 BPM/18 RPM;43.79.1;43.79.1.1;0;0;NÃO;;1;0;0;0;0;0;1;0;0;0;0;0;0;0;0;0;0;NÃO;VÍTIMAS OUVIRAM CERCA DE CINCO DISPAROS DE ARMA DE FOGO E ENCONTRAREM UM HOMEM CAÍDO NA VIA PÚBLICA. A VÍTIMA, IDENTIFICADA COMO BRUNO HENRIQUE DE JESUS PAIÃO, FOI ATINGIDA POR DOIS TIROS E MORREU. MOTIVAÇÃO ENVOLVIMENTO COM DROGAS.
2025-024259154-001;2025;5;MAIO;26;26/05/2025;06:00:00;SEGUNDA-FEIRA;1;De 06:00 as 06:59;De 06:00 as 11:59;MG;MONTE BELO;314300;JARDIM CARMEM;JARDIM CARMEM;INVÁLIDO;;292;;PERIMETRO URBANO;B01504;FEMINICIDIO;CONSUMADO;U33004;ATEND. DENUNCIA INFRACOES CONTRA MULHER(VIOLENCIA DOMESTICA);CONSUMADO;;;;;;;MORADOR / VISITANTE DE RESIDENCIA;115;PASSIONAL;115;INST.CONTUNDENTE/CORTANTE/PERFURANTE (ARMA BRANCA);1900;APARTAMENTO;1501;-21,335125;-46,36783333;1439;3 GP/3 PEL/79 CIA PM/43 BPM/18 RPM;7473;18 RPM;6871;43 BPM;1429;79 CIA PM/43 BPM/18 RPM;M7473;18 RPM;M6871;43 BPM/18 RPM;M1429;79 CIA PM/43 BPM/18 RPM;M1436;3 PEL/79 CIA PM/43 BPM/18 RPM;43.79.3;43.79.3.3;0;1;NÃO;;0;0;0;1;0;0;1;0;0;0;0;0;0;0;0;0;0;NÃO;FEMINICÍDIO OCORRIDO EM MONTE BELO/MG, A VÍTIMA, NÚBIA CALDAS SANTOS, FOI MORTA A FACADAS POR SEU EX-COMPANHEIRO, JEREMIAS AFONSO DA SILVA, QUE SE APRESENTOU ESPONTANEAMENTE NO QUARTEL DA PM, CONFESSANDO O CRIME. MOTIVAÇÃO CIÚMES.
2025-030035725-001;2025;6;JUNHO;28;28/06/2025;08:00:00;SABADO;6;De 08:00 as 08:59;De 06:00 as 11:59;MG;GUAXUPE;312870;VILA CARLONI;;JOSE ACULA;;56;;PERIMETRO URBANO;B01504;FEMINICIDIO;CONSUMADO;U33004;ATEND. DENUNCIA INFRACOES CONTRA MULHER(VIOLENCIA DOMESTICA);CONSUMADO;B01148;SEQUESTRO E CARCERE PRIVADO;CONSUMADO;B01121;HOMICIDIO;TENTADO;MORADOR / VISITANTE DE RESIDENCIA;115;ATRITO FAMILIAR;107;ARMAS DE FOGO;300;CASA;1502;-21,2976163;-46,7279413;1430;1 PEL/79 CIA PM/43 BPM/18 RPM;7473;18 RPM;6871;43 BPM;1429;79 CIA PM/43 BPM/18 RPM;M7473;18 RPM;M6871;43 BPM/18 RPM;M1429;79 CIA PM/43 BPM/18 RPM;M1429;79 CIA PM/43 BPM/18 RPM;43.79.1;43.79.1.1;0;1;NÃO;;0;0;0;1;0;0;1;0;2;0;1;0;3;0;0;0;0;NÃO;DÁRIO JOSÉ DE ALMEIDA JÚNIOR FEZ UMA VIDEOCHAMADA CONFESSANDO TER MATADO SUA ESPOSA, ANELISE DE CARVALHO GOMES COM DISPARSO DE ARMA DE FOGO, E INFORMOU ESTAR MANTENDO SUA SOBRINHA DE 8 ANOS, MARIA LUIZA, EM CÁRCERE, COM INTENÇÃO DE MATÁ-LA. DURANTE A OCORRÊNCIA, EFETUOU UM DISPARO CONTRA UMA VIATURA DA PM E AMEAÇOU A CRIANÇA COM ARMA DE FOGO, CHEGANDO A AFIRMAR QUE A HAVIA ABUSADO SEXUALMENTE.
2025-031299375-001;2025;7;JULHO;5;05/07/2025;22:30:00;SABADO;6;De 22:00 as 22:59;De 18:00 as 23:59;MG;NOVA RESENDE;314510;VILA DORINTO MORATO;;JOAQUIM ALVES DE BRITO;;36;;PERIMETRO URBANO;B01121;HOMICIDIO;CONSUMADO;;;;;;;;;;MORADOR / VISITANTE DE RESIDENCIA;115;BRIGA / ATRITO;142;INST.CONTUNDENTE/CORTANTE/PERFURANTE (ARMA BRANCA);1900;CASA;1502;-21,122411;-46,4277926;1433;4 PEL/79 CIA PM/43 BPM/18 RPM;7473;18 RPM;6871;43 BPM;1429;79 CIA PM/43 BPM/18 RPM;M7473;18 RPM;M6871;43 BPM/18 RPM;M1429;79 CIA PM/43 BPM/18 RPM;M1433;4 PEL/79 CIA PM/43 BPM/18 RPM;43.79.4;43.79.4.1;0;1;NÃO;;1;0;0;0;0;0;1;0;0;0;0;0;0;0;0;0;0;NÃO;ADELMO OLIVEIRA DA CONCEIÇÃO DEU ENTRADA NO HOSPITAL SANTA RITA COM FERIMENTOS CAUSADOS POR FACA, O AUTOR, EDIVILSON FELIPE DE OLIVEIRA, VIZINHO DA VÍTIMA, CONFESSOU O CRIME E ALEGOU LEGÍTIMA DEFESA APÓS SER AGREDIDO E AMEAÇADO DURANTE UMA DISCUSSÃO. HAVIA CONFLITOS FREQUENTES ENTRE AS PARTES MOTIVADOS POR FESTAS REALIZADAS PELA VÍTIMA.
2025-031775010-001;2025;7;JULHO;8;08/07/2025;22:30:00;TERCA-FEIRA;2;De 22:00 as 22:59;De 18:00 as 23:59;MG;JURUAIA;313690;JARDIM SANTO ANTONIO 1;;JACOB SENEDESE;;498;;PERIMETRO URBANO;B01121;HOMICIDIO;CONSUMADO;;;;;;;;;;MORADOR / VISITANTE DE RESIDENCIA;115;BRIGA / ATRITO;142;INST.CONTUNDENTE/CORTANTE/PERFURANTE (ARMA BRANCA);1900;CASA;1502;-21,2495585;-46,578927;1436;3 PEL/79 CIA PM/43 BPM/18 RPM;7473;18 RPM;6871;43 BPM;1429;79 CIA PM/43 BPM/18 RPM;M7473;18 RPM;M6871;43 BPM/18 RPM;M1429;79 CIA PM/43 BPM/18 RPM;M1436;3 PEL/79 CIA PM/43 BPM/18 RPM;43.79.3;43.79.3.2;0;1;NÃO;;1;0;0;0;0;0;1;0;0;0;0;0;0;0;0;0;0;NÃO;UM HOMEM EMBRIAGADO ESTARIA GRITANDO DENTRO DE CASA, NO LOCAL OS POLICIAIS ENCONTRARAM CLÁUDIO REIS DA SILVA JÁ SEM VIDA, COM FERIMENTOS GRAVES NO PESCOÇO E CABEÇA. NO INTERIOR DA RESIDÊNCIA, O AUTOR JORGE FERNANDO DA SILVA FOI LOCALIZADO COM UMA TESOURA ENSANGUENTADA NAS MÃOS. TENDO CONFESSADO O HOMICÍDIO.
2025-033705149-001;2025;7;JULHO;20;20/07/2025;22:30:00;DOMINGO;7;De 22:00 as 22:59;De 18:00 as 23:59;MG;ITAMOGI;313290;CENTRO;;JOSE MARIA ALKIMIN;;254;;PERIMETRO URBANO;B01121;HOMICIDIO;CONSUMADO;;;;;;;;;;TRANSEUNTE;111;PASSIONAL;115;OUTROS MEIOS ;9900;VIA DE ACESSO PUBLICA;2101;-21,0784895;-47,0501419;1471;4 PEL/95 CIA PM/43 BPM/18 RPM;7473;18 RPM;6871;43 BPM;1458;95 CIA PM/43 BPM/18 RPM;M7473;18 RPM;M6871;43 BPM/18 RPM;M1458;95 CIA PM/43 BPM/18 RPM;M1471;4 PEL/95 CIA PM/43 BPM/18 RPM;43.95.4;43.95.4.3;0;1;NÃO;;1;0;0;0;0;0;1;0;0;0;0;0;0;0;0;0;0;NÃO;WESLEY TENTOU INICIAR UMA BRIGA COM UMA CHAVE DE RODA E ACABOU FERIDO POR UM FACÃO, WESLEY CONSEGUIU ATACAR A VÍTIMA COM UM CANIVETE APÓS FINGIR ESTAR DESMAIADO, DURANTE UMA TENTATIVA DE SOCORRO. A ATUAL NAMORADA DA VÍTIMA E EX-ESPOSA DO AUTOR. 
